省,市,区,全名,别名,性质,等级
北京市,北京市,朝阳区,望京西园四区社区卫生服务站,望京西园四区社区卫生服务站,其他/其他,未知
北京市,北京市,朝阳区,北京相国泽仁科贸西诺口腔医院,北京西诺口腔医院,其他/专科医院,民营医院
北京市,北京市,朝阳区,北京华大中医医院,北京华大中医院,其他/专科医院,未评级
北京市,北京市,朝阳区,北京黎明医院,北京黎明医院,公立/综合医院,一级甲等
北京市,北京市,朝阳区,北京美迪胎记医学研究院,北京美迪医院胎记科,其他/专科医院,未评级
北京市,北京市,朝阳区,北京科瓦嘉铭口腔门诊部,科瓦齿科嘉铭门诊,民营/专科医院,民营医院
北京市,北京市,朝阳区,北京蓝海中医院,北京蓝海中医医院,合资/专科医院,未知
北京市,北京市,朝阳区,北京科瓦齿科嘉铭中心门诊店,北京科瓦齿科,民营/专科医院,未评级
北京市,北京市,朝阳区,嘉和口腔,嘉和口腔连锁,民营/门诊,民营医院
北京市,北京市,朝阳区,北京济民中医院,北京济民中医院,民营/综合医院,未知
北京市,北京市,朝阳区,北京世纪村门诊部,北京世纪村门诊部,公立/综合医院,一级乙等
北京市,北京市,朝阳区,东风社区卫生服务中心,东风社区卫生服务中心,其他/其他,未知
北京市,北京市,朝阳区,北京市朝阳区华纺易城社区卫生服务站,北京市朝阳区华纺易城社区卫生服务站,其他/其他,未知
北京市,北京市,朝阳区,朝阳区太阳宫地区牛王庙社区卫生服务站,朝阳区太阳宫地区牛王庙社区卫生服务站,公立/综合医院,未知
北京市,北京市,朝阳区,朝阳区望京街道南湖渠西里社区卫生服务站,朝阳区望京街道南湖渠西里社区卫生服务站,其他/其他,未知
北京市,北京市,朝阳区,朝阳区朝外街道雅宝路社区卫生服务站,朝阳区朝外街道雅宝路社区卫生服务站,其他/其他,未知
北京市,北京市,朝阳区,朝阳区劲松街道劲松一区社区卫生服务站,朝阳区劲松街道劲松一区社区卫生服务站,其他/其他,未知
北京市,北京市,朝阳区,豆各庄社区卫生服务中心,豆各庄社区卫生服务中心,公立/其他,未知
北京市,北京市,朝阳区,平房社区卫生服务中心,平房社区卫生服务中心,其他/其他,未知
北京市,北京市,朝阳区,团结湖社区卫生服务中心,团结湖社区卫生服务中心,其他/其他,未知
北京市,北京市,朝阳区,朝阳区东坝地区西北门社区卫生服务站,朝阳区东坝地区西北门社区卫生服务站,其他/其他,未知
北京市,北京市,朝阳区,十里河社区卫生服务站,十里河社区卫生服务站,其他/其他,未知
北京市,北京市,朝阳区,朝阳区将台地区将府家园社区卫生服务站,朝阳区将台地区将府家园社区卫生服务站,其他/其他,未知
北京市,北京市,朝阳区,朝阳区左家庄街道静安东里社区卫生服务站,朝阳区左家庄街道静安东里社区卫生服务站,公立/其他,未知
北京市,北京市,朝阳区,朝阳区将台地区芳园里社区卫生服务站,朝阳区将台地区芳园里社区卫生服务站,其他/其他,未知
北京市,北京市,朝阳区,香河园社区卫生服务中心,香河园社区卫生服务中心,其他/其他,未知
北京市,北京市,朝阳区,朝阳区三间房地区天泰苑社区卫生服务站,朝阳区三间房地区天泰苑社区卫生服务站,其他/其他,未知
北京市,北京市,朝阳区,朝阳区平房地区亮马厂社区卫生服务站,朝阳区平房地区亮马厂社区卫生服务站,其他/其他,未知
北京市,北京市,朝阳区,朝阳区豆各庄地区绿丰家园社区卫生服务站,朝阳区豆各庄地区绿丰家园社区卫生服务站,公立/其他,未知
北京市,北京市,朝阳区,南郎家园社区卫生服务站,南郎家园社区卫生服务站,其他/其他,未知
北京市,北京市,朝阳区,北京长阳镇朱岗子社区卫生服务站,北京长阳镇朱岗子社区卫生服务站,其他/其他,未知
北京市,北京市,朝阳区,北京万东社区卫生服务站,北京万东社区卫生服务站,其他/其他,未知
北京市,北京市,朝阳区,北京华府妇儿医院,华府妇儿医院,其他/专科医院,未评级
北京市,北京市,朝阳区,北京天使儿童医院,北京儿童医院,合资/专科医院,未评级
北京市,北京市,朝阳区,朝阳区潘家园街道磨房南里社区卫生服务站,朝阳区潘家园街道磨房南里社区卫生服务站,其他/其他,未知
北京市,北京市,朝阳区,北京市朝阳区潘家园街道华威北里社区卫生服务站,北京市朝阳区潘家园街道华威北里社区卫生服务站,其他/其他,未知
北京市,北京市,朝阳区,北京市朝阳区金盏地区小店社区卫生服务站,北京市朝阳区金盏地区小店社区卫生服务站,其他/其他,未知
北京市,北京市,朝阳区,北京市朝阳区金盏地区东村社区卫生服务站,北京市朝阳区金盏地区东村社区卫生服务站,其他/其他,未知
北京市,北京市,朝阳区,朝阳区潘家园街道松榆西里社区卫生服务站,朝阳区潘家园街道松榆西里社区卫生服务站,其他/其他,未知
北京市,北京市,朝阳区,北京市朝阳区潘家园街道松楡东里社区卫生服务站,北京市朝阳区潘家园街道松楡东里社区卫生服务站,其他/其他,未知
北京市,北京市,朝阳区,潘家园社区卫生服务中心,潘家园社区卫生服务中心,其他/其他,未知
北京市,北京市,朝阳区,双井社区卫生服务中心,双井社区卫生服务中心,其他/其他,未知
北京市,北京市,朝阳区,南磨房社区卫生服务中心,南磨房社区卫生服务中心,其他/其他,未知
北京市,北京市,朝阳区,吕家营社区卫生服务站,吕家营社区卫生服务站,其他/其他,未知
北京市,北京市,朝阳区,朝阳区十八里店地区老君堂社区卫生服务站,朝阳区十八里店地区老君堂社区卫生服务站,其他/其他,未知
北京市,北京市,朝阳区,朝阳区十八里店地区横街子社区卫生服务站,朝阳区十八里店地区横街子社区卫生服务站,其他/其他,未知
北京市,北京市,朝阳区,十八里店社区卫生服务中心,十八里店社区卫生服务中心,其他/其他,未知
北京市,北京市,朝阳区,朝阳区王四营地区观音堂社区卫生服务站,朝阳区王四营地区观音堂社区卫生服务站,其他/其他,未知
北京市,北京市,朝阳区,劲松社区卫生服务中心,劲松社区卫生服务中心,其他/其他,未知
北京市,北京市,朝阳区,朝阳区大屯街道嘉铭园社区卫生服务站,朝阳区大屯街道嘉铭园社区卫生服务站,其他/其他,未知
北京市,北京市,朝阳区,朝阳区大屯街道慧忠里社区卫生服务站,朝阳区大屯街道慧忠里社区卫生服务站,其他/其他,未知
北京市,北京市,朝阳区,朝阳区大屯街道慧忠北里卫生站,朝阳区大屯街道慧忠北里卫生站,其他/其他,未知
北京市,北京市,朝阳区,小关街道惠新北里社区卫生服务站,小关街道惠新北里社区卫生服务站,其他/其他,未知
北京市,北京市,朝阳区,小关社区卫生服务中心,小关社区卫生服务中心,其他/其他,未知
北京市,北京市,朝阳区,朝阳区和平街街道樱花园社区卫生服务站,朝阳区和平街街道樱花园社区卫生服务站,其他/其他,未知
北京市,北京市,朝阳区,朝阳区安贞街道安贞西里社区卫生服务站,朝阳区安贞街道安贞西里社区卫生服务站,其他/其他,未知
北京市,北京市,朝阳区,朝阳区安贞街道安华西里社区卫生服务站,朝阳区安贞街道安华西里社区卫生服务站,其他/其他,未知
北京市,北京市,朝阳区,朝阳区安贞街道安华里社区卫生服务站,朝阳区安贞街道安华里社区卫生服务站,其他/其他,未知
北京市,北京市,朝阳区,朝阳区将台地区驼房营社区卫生服务站,朝阳区将台地区驼房营社区卫生服务站,其他/其他,未知
北京市,北京市,朝阳区,朝阳区和平街街道砖角楼社区卫生服务站,朝阳区和平街街道砖角楼社区卫生服务站,其他/其他,未知
北京市,北京市,朝阳区,朝阳区和平街街道小黄庄社区卫生服务站,朝阳区和平街街道小黄庄社区卫生服务站,其他/其他,未知
北京市,北京市,朝阳区,朝阳区亚运村街道北辰社区卫生服务站,朝阳区亚运村街道北辰社区卫生服务站,公立/综合医院,未知
北京市,北京市,朝阳区,朝阳区亚运村街道祁家豁子社区卫生服务站,朝阳区亚运村街道祁家豁子社区卫生服务站,其他/其他,未知
北京市,北京市,朝阳区,亚运村社区卫生服务中心,亚运村社区卫生服务中心,其他/其他,未知
北京市,北京市,朝阳区,定福庄西街社区卫生服务站,定福庄西街社区卫生服务站,其他/其他,未知
北京市,北京市,朝阳区,十八里店社区卫生服务站,十八里店社区卫生服务站,其他/其他,未知
北京市,北京市,朝阳区,核桃园北里社区卫生服务站,核桃园北里社区卫生服务站,其他/其他,未知
北京市,北京市,朝阳区,花家地西里社区卫生服务站,花家地西里社区卫生服务站,其他/其他,未知
北京市,北京市,朝阳区,芍药居南里社区卫生服务站,芍药居南里社区卫生服务站,其他/其他,未知
北京市,北京市,朝阳区,朝阳区来广营地区青年城社区卫生服务站,朝阳区来广营地区青年城社区卫生服务站,其他/其他,未知
北京市,北京市,朝阳区,朝阳区亚运村街道华严北里社区卫生服务站,朝阳区亚运村街道华严北里社区卫生服务站,其他/其他,未知
北京市,北京市,朝阳区,大屯社区卫生服务中心,大屯社区卫生服务中心,其他/其他,未知
北京市,北京市,朝阳区,朝阳区孙河地区沙子营社区卫生服务站,朝阳区孙河地区沙子营社区卫生服务站,其他/其他,未知
北京市,北京市,朝阳区,朝阳区十八里店地区西直河社区卫生服务站,朝阳区十八里店地区西直河社区卫生服务站,其他/其他,未知
北京市,北京市,朝阳区,朝阳区六里屯街道十里堡北里社区卫生服务站,朝阳区六里屯街道十里堡北里社区卫生服务站,其他/其他,未知
北京市,北京市,朝阳区,北京市朝阳区金盏地区雷庄社区卫生服务站,北京市朝阳区金盏地区雷庄社区卫生服务站,其他/其他,未知
北京市,北京市,朝阳区,北京瑞程医院管理有限公司瑞尔口腔医院,北京瑞程医院管理有限公司瑞尔口腔医院,民营/专科医院,未知
北京市,北京市,朝阳区,北京麦瑞骨科医院,北京麦瑞骨科医院,民营/专科医院,未评级
北京市,北京市,朝阳区,北京藏医院,北京民族医院,公立/综合医院,一级甲等
北京市,北京市,朝阳区,北京凤凰妇科医院,北京凤凰医院,合资/专科医院,未评级
北京市,北京市,朝阳区,北京瑞丽妇科医院,北京瑞丽妇科医院,民营/专科医院,民营医院
北京市,北京市,朝阳区,北京五方桥中医肾病医院,北京五方中医肾病医院,其他/专科医院,未知
北京市,北京市,朝阳区,北京东区儿童医院,儿童医院集团东区儿童医院,合资/专科医院,未评级
北京市,北京市,朝阳区,北京龙泽日盛整形美容诊所,北京龙泽日盛整形美容医院,民营/专科医院,未评级
北京市,北京市,朝阳区,北京谐和美医疗,北京谐和美,民营/专科医院,民营医院
北京市,北京市,朝阳区,朝阳区北亚医院,朝阳区北亚医院,公立/综合医院,未知
北京市,北京市,朝阳区,朝阳区东华医院,朝阳区东华医院,公立/综合医院,未知
北京市,北京市,朝阳区,朝阳区红庙医院,朝阳区红庙医院,公立/综合医院,未知
北京市,北京市,朝阳区,朝阳区红十字会医院,朝阳区红十字会医院,公立/综合医院,未知
北京市,北京市,朝阳区,首都医科大学附属北京妇产医院,北京妇产医院,公立/综合医院,三级甲等　　
北京市,北京市,朝阳区,北京海文妇科医院,北京海文妇科医院,公立/综合医院,一级甲等
北京市,北京市,朝阳区,北京基恩医院,北京基恩医院,民营/综合医院,一级甲等
北京市,北京市,朝阳区,北京方舟白癜风牛皮癣医学研究院,北京方舟白癜风牛皮癣医学研究院,个体户/专科医院,未知
北京市,北京市,朝阳区,北京北亚医院,北京北亚医院,公立/综合医院,未知
