省,市,区,全名,别名,性质,等级
广东省,湛江市,霞山区,广东省八建职工医院,广东省八建职工医院,公立/综合医院,一级甲等
广东省,湛江市,霞山区,湛江市第二人民医院,广东医学院第二附属医院,公立/综合医院,二级甲等
广东省,湛江市,霞山区,湛江海洋渔业公司职工医院,湛江海洋渔业公司职工医院,公立/综合医院,一级甲等
广东省,湛江市,霞山区,广东省农垦中心医院,湛江肿瘤医院,公立/综合医院,三级甲等　　
广东省,湛江市,霞山区,中国人民解放军第四二二医院,中国人民解放军第四二二医院,公立/综合医院,三级甲等　　
广东省,湛江市,霞山区,湛江和家宝妇产医院,湛江和家宝妇产医院,个体户/综合医院,二级甲等
广东省,湛江市,霞山区,湛江仁爱医院,原港区医院第二门诊部,公立/综合医院,一级甲等
广东省,湛江市,霞山区,湛江华泰医院,湛江华泰老年病专科,民营/专科医院,民营医院
广东省,湛江市,霞山区,湛江华美整形美容医院,华美整形医院,其他/综合医院,未知
广东省,湛江市,霞山区,湛江国济男科医院,湛江男科医院,其他/专科医院,未知
广东省,湛江市,霞山区,湛江东大肛肠医院,湛江东大肛肠医院,民营/专科医院,未评级
广东省,湛江市,霞山区,湛江现代男科医院,湛江男科医院,民营/专科医院,民营医院
广东省,湛江市,霞山区,湛江霞山叶美厚口腔诊所,湛江霞山叶美厚口腔诊所,民营/其他,未知
广东省,湛江市,霞山区,湛江霞山林九二口腔诊所,湛江霞山林九二口腔诊所,民营/其他,未知
广东省,湛江市,霞山区,湛江霞山杨晓国口腔诊所,湛江霞山杨晓国口腔诊所,民营/其他,未知
广东省,湛江市,霞山区,湛江霞山邵海贰口腔诊所,湛江霞山邵海贰口腔诊所,民营/其他,未知
广东省,湛江市,霞山区,湛江霞山王艳媚口腔诊所,湛江霞山王艳媚口腔诊所,民营/其他,未知
广东省,湛江市,霞山区,湛江霞山钟德霖口腔诊所,湛江霞山钟德霖口腔诊所,民营/其他,未知
广东省,湛江市,霞山区,湛江霞山容爱新口腔诊所,湛江霞山容爱新口腔诊所,民营/其他,未知
广东省,湛江市,霞山区,湛江霞山区吴奇生口腔诊所,湛江霞山区吴奇生口腔诊所,民营/其他,未知
广东省,湛江市,霞山区,湛江霞山邵海口腔诊所,湛江霞山邵海口腔诊所,民营/其他,未知
广东省,湛江市,霞山区,湛江市霞山口腔疾病防治中心,湛江市霞山口腔疾病防治中心,其他/其他,未知
广东省,湛江市,霞山区,湛江霞山黄欣中医诊所,湛江霞山黄欣中医诊所,民营/其他,未知
广东省,湛江市,霞山区,湛江霞山成焕明西医诊所,湛江霞山成焕明西医诊所,民营/其他,未知
广东省,湛江市,霞山区,湛江霞山澳泰医疗美容诊所,湛江霞山澳泰医疗美容诊所,民营/其他,未评级
广东省,湛江市,霞山区,湛江霞山老医师诊所,湛江霞山老医师诊所,民营/其他,未知
广东省,湛江市,霞山区,湛江霞山麦小卡西医诊所,湛江霞山麦小卡西医诊所,民营/其他,未知
广东省,湛江市,霞山区,湛江霞山林秀珍口腔诊所,湛江霞山林秀珍口腔诊所,民营/其他,未知
广东省,湛江市,霞山区,湛江霞山陈金玉口腔诊所,湛江霞山陈金玉口腔诊所,民营/其他,未知
广东省,湛江市,霞山区,霞山黄华口腔诊所,霞山黄华口腔诊所,民营/其他,未知
广东省,湛江市,霞山区,湛江霞山邵华珍口腔诊所,湛江霞山邵华珍口腔诊所,民营/其他,未知
广东省,湛江市,霞山区,湛江霞山王维明口腔诊所,湛江霞山王维明口腔诊所,民营/其他,未知
广东省,湛江市,霞山区,湛江霞山洪帝林口腔诊所,湛江霞山洪帝林口腔诊所,民营/其他,未知
广东省,湛江市,霞山区,湛江霞山李光口腔诊所,湛江霞山李光口腔诊所,民营/其他,未知
广东省,湛江市,霞山区,霞山区友谊街道办建新东社区卫生服务站,霞山区友谊街道办建新东社区卫生服务站,其他/其他,未知
广东省,湛江市,霞山区,霞山区友谊街道办事处建新社区卫生服务站,霞山区友谊街道办事处建新社区卫生服务站,其他/其他,未知
广东省,湛江市,霞山区,湛江市霞山区新园街道办事处龙丁社区卫生服务站,湛江市霞山区新园街道办事处龙丁社区卫生服务站,其他/其他,未知
广东省,湛江市,霞山区,湛江市霞山区东新社区卫生服务中心,湛江市霞山区东新社区卫生服务中心,其他/其他,未知
广东省,湛江市,霞山区,霞山区妇幼保健院友谊街道办事处石头村社区卫生服务站,霞山区妇幼保健院友谊街道办事处石头村社区卫生服务站,其他/其他,未知
广东省,湛江市,霞山区,湛江市霞山区新兴社区卫生服务中心,湛江市霞山区新兴社区卫生服务中心,其他/其他,未知
广东省,湛江市,霞山区,霞山区友谊街道办事处龙划社区卫生服务站,霞山区友谊街道办事处龙划社区卫生服务站,民营/其他,未评级
广东省,湛江市,霞山区,湛江市霞山区爱国社区卫生服务站,湛江市霞山区爱国社区卫生服务站,其他/其他,未知
广东省,湛江市,霞山区,霞山区港区人民医院新兴社区卫生服务中心,霞山区港区人民医院新兴社区卫生服务中心,其他/其他,未知
广东省,湛江市,霞山区,霞山区霞湖医院解放社区卫生服务站,霞山区霞湖医院解放社区卫生服务站,其他/其他,未知
广东省,湛江市,霞山区,霞山友谊社区医疗卫生服务中心,霞山友谊社区医疗卫生服务中心,其他/其他,未知
广东省,湛江市,霞山区,湛江市霞山区新园社区卫生服务站,湛江市霞山区新园社区卫生服务站,其他/其他,未知
广东省,湛江市,霞山区,霞山港区医院海滨社区卫生服务站,霞山港区医院海滨社区卫生服务站,其他/其他,未知
广东省,湛江市,霞山区,霞山区海滨社区卫生服务站,霞山区海滨社区卫生服务站,其他/其他,未知
广东省,湛江市,霞山区,湛江市霞山区爱国街道办事处创新社区卫生服务站,湛江市霞山区爱国街道办事处创新社区卫生服务站,其他/其他,未知
广东省,湛江市,霞山区,湛江霞山苏敬铭口腔诊所,湛江霞山苏敬铭口腔诊所,民营/其他,未知
广东省,湛江市,霞山区,湛江霞山林权中医诊所,湛江霞山林权中医诊所,民营/其他,未知
广东省,湛江市,霞山区,湛江霞山林冠口腔诊所,湛江霞山林冠口腔诊所,民营/其他,未知
广东省,湛江市,霞山区,湛江霞山谭伟明西医诊所,湛江霞山谭伟明西医诊所,民营/其他,未知
广东省,湛江市,霞山区,湛江霞山庄小戟口腔诊所,湛江霞山庄小戟口腔诊所,民营/其他,未知
广东省,湛江市,霞山区,湛江霞山揭素誉口腔诊所,湛江霞山揭素誉口腔诊所,民营/其他,未知
广东省,湛江市,霞山区,湛江霞山王成口腔诊所,湛江霞山王成口腔诊所,民营/其他,未知
广东省,湛江市,霞山区,湛江霞山蔡连口腔诊所,湛江霞山蔡连口腔诊所,民营/其他,未知
广东省,湛江市,霞山区,湛江霞山蔡连口腔诊所,湛江霞山蔡连口腔诊所,民营/其他,未知
广东省,湛江市,霞山区,湛江霞山杨香春口腔诊所,湛江霞山杨香春口腔诊所,民营/其他,未知
广东省,湛江市,霞山区,湛江霞山彭娇莲口腔诊所,湛江霞山彭娇莲口腔诊所,民营/其他,未知
广东省,湛江市,霞山区,湛江霞山邓仲赞口腔诊所,湛江霞山邓仲赞口腔诊所,民营/其他,未知
广东省,湛江市,霞山区,湛江霞山邓金领口腔诊所,湛江霞山邓金领口腔诊所,民营/其他,未知
广东省,湛江市,霞山区,湛江霞山邓仲政口腔诊所,湛江霞山邓仲政口腔诊所,民营/未知,未知
广东省,湛江市,霞山区,湛江霞山林红口腔诊所,湛江霞山林红口腔诊所,民营/其他,未知
广东省,湛江市,霞山区,湛江霞山容志新口腔诊所,湛江霞山容志新口腔诊所,民营/其他,未知
广东省,湛江市,霞山区,湛江霞山王莲芳口腔诊所,湛江霞山王莲芳口腔诊所,民营/其他,未知
广东省,湛江市,霞山区,湛江霞山蔡康行西医诊所,湛江霞山蔡康行西医诊所,民营/其他,未知
广东省,湛江市,霞山区,湛江市霞山区华光诊所,湛江市霞山区华光诊所,民营/其他,未知
广东省,湛江市,霞山区,湛江霞山刘少雄西医诊所,湛江霞山刘少雄西医诊所,民营/其他,未知
广东省,湛江市,霞山区,湛江霞山杏林陈昶斌诊所,湛江霞山杏林陈昶斌诊所,民营/其他,未知
广东省,湛江市,霞山区,湛江霞山黄秋生中医诊所,湛江霞山黄秋生中医诊所,民营/其他,未知
广东省,湛江市,霞山区,湛江霞山李汉卿中医诊所,湛江霞山李汉卿中医诊所,民营/其他,未知
广东省,湛江市,霞山区,湛江霞山曾桂梅中医诊所,湛江霞山曾桂梅中医诊所,其他/其他,未知
广东省,湛江市,霞山区,湛江霞山梁钺中医诊所,湛江霞山梁钺中医诊所,民营/其他,未知
广东省,湛江市,霞山区,湛江霞山钟炳炎西医诊所,湛江霞山钟炳炎西医诊所,民营/其他,未知
广东省,湛江市,霞山区,湛江霞山杨朱芳中医诊所,湛江霞山杨朱芳中医诊所,民营/其他,未知
广东省,湛江市,霞山区,湛江霞山李剑锋中医诊所,湛江霞山李剑锋中医诊所,民营/其他,未知
广东省,湛江市,霞山区,湛江霞山林伟玉口腔诊所,湛江霞山林伟玉口腔诊所,民营/其他,未知
广东省,湛江市,霞山区,湛江霞山王淑珍西医诊所,湛江霞山王淑珍西医诊所,民营/其他,未知
广东省,湛江市,霞山区,湛江霞山杨竹莲西医诊所,湛江霞山杨竹莲西医诊所,民营/其他,未知
广东省,湛江市,霞山区,湛江霞山马日洪西医诊所,湛江霞山马日洪西医诊所,民营/其他,未知
广东省,湛江市,霞山区,湛江霞山王艳霜口腔诊所,湛江霞山王艳霜口腔诊所,民营/其他,未知
广东省,湛江市,霞山区,湛江霞山张鸿英西医诊所,湛江霞山张鸿英西医诊所,其他/其他,未知
广东省,湛江市,霞山区,湛江霞山同仁诊所,湛江霞山同仁诊所,民营/其他,未知
广东省,湛江市,霞山区,湛江霞山王华清口腔诊所,湛江霞山王华清口腔诊所,民营/其他,未知
广东省,湛江市,霞山区,湛江霞山杨瑞欣中医诊所,湛江霞山杨瑞欣中医诊所,民营/其他,未知
广东省,湛江市,霞山区,湛江霞山黄家兴中医诊所,湛江霞山黄家兴中医诊所,其他/其他,未知
广东省,湛江市,霞山区,湛江霞山梁海德中医诊所,湛江霞山梁海德中医诊所,民营/其他,未知
广东省,湛江市,霞山区,湛江霞山陈菊才中医诊所,湛江霞山陈菊才中医诊所,民营/其他,未知
广东省,湛江市,霞山区,湛江霞山吴瑞海中医诊所,湛江霞山吴瑞海中医诊所,民营/其他,未知
广东省,湛江市,霞山区,湛江霞山吴亚清中医诊所,湛江霞山吴亚清中医诊所,民营/其他,未知
广东省,湛江市,霞山区,湛江霞山林贤中医诊所,湛江霞山林贤中医诊所,民营/其他,未知
广东省,湛江市,霞山区,湛江霞山邓观华中医诊所,湛江霞山邓观华中医诊所,民营/其他,未知
广东省,湛江市,霞山区,湛江霞山杨作超西医诊所,湛江霞山杨作超西医诊所,民营/其他,未知
广东省,湛江市,霞山区,湛江霞山美联整形外科诊所,湛江霞山美联整形外科诊所,民营/其他,未知
广东省,湛江市,霞山区,湛江霞山龙家幸西医诊所,湛江霞山龙家幸西医诊所,民营/其他,未知
广东省,湛江市,霞山区,湛江霞山湛海诊所,湛江霞山湛海诊所,民营/其他,未知
广东省,湛江市,霞山区,湛江霞山文明诊所,湛江霞山文明诊所,其他/其他,未知
广东省,湛江市,霞山区,湛江霞山陈丽如西医诊所,湛江霞山陈丽如西医诊所,民营/其他,未知
广东省,湛江市,霞山区,湛江霞山何惠珍中医诊所,湛江霞山何惠珍中医诊所,民营/其他,未知
广东省,湛江市,霞山区,湛江霞山黄有光中医诊所,湛江霞山黄有光中医诊所,其他/其他,未知
广东省,湛江市,霞山区,湛江霞山陈宇中医诊所,湛江霞山陈宇中医诊所,民营/其他,未知
广东省,湛江市,霞山区,湛江霞山谢培美中医诊所,湛江霞山谢培美中医诊所,民营/其他,未知
广东省,湛江市,霞山区,湛江霞山陈兆兴中医诊所,湛江霞山陈兆兴中医诊所,民营/其他,未知
广东省,湛江市,霞山区,湛江霞山张木生中医诊所,湛江霞山张木生中医诊所,民营/其他,未知
广东省,湛江市,霞山区,湛江霞山吴国才中医诊所,湛江霞山吴国才中医诊所,民营/其他,未知
广东省,湛江市,霞山区,湛江霞山陈忠文中医诊所,湛江霞山陈忠文中医诊所,民营/其他,未知
广东省,湛江市,霞山区,湛江霞山陈炳洲中医诊所,湛江霞山陈炳洲中医诊所,民营/其他,未知
广东省,湛江市,霞山区,湛江霞山庞真受中医诊所,湛江霞山庞真受中医诊所,民营/其他,未知
广东省,湛江市,霞山区,湛江霞山车文兴中医诊所,湛江霞山车文兴中医诊所,民营/其他,未知
广东省,湛江市,霞山区,湛江霞山陈耀中医诊所,湛江霞山陈耀中医诊所,其他/其他,未知
广东省,湛江市,霞山区,湛江霞山陈丽玉中医诊所,湛江霞山陈丽玉中医诊所,民营/其他,未知
广东省,湛江市,霞山区,坡头南调叶二妹口腔诊所,坡头南调叶二妹口腔诊所,其他/其他,未知
广东省,湛江市,霞山区,湛江霞山潘鸿鹄中医诊所,湛江霞山潘鸿鹄中医诊所,民营/其他,未知
广东省,湛江市,霞山区,湛江霞山李凤梅中医诊所,湛江霞山李凤梅中医诊所,民营/其他,未知
广东省,湛江市,霞山区,湛江霞山吴炳芬中医诊所,湛江霞山吴炳芬中医诊所,民营/其他,未知
广东省,湛江市,霞山区,民盟湛江延安光明诊所,民盟湛江延安光明诊所,民营/其他,未知
广东省,湛江市,霞山区,霞山区政协新园诊所,霞山区政协新园诊所,民营/其他,未知
广东省,湛江市,霞山区,湛江好好门诊部,湛江好好门诊部,民营/其他,未知
广东省,湛江市,霞山区,湛江霞山丁华诊所,湛江霞山丁华诊所,民营/其他,未知
广东省,湛江市,霞山区,广东医学院附属医院,广东医学院附属医院,公立/综合医院,三级甲等　　
广东省,湛江市,霞山区,湛江市港区人民医院,湛江市港区人民医院,公立/综合医院,未知
广东省,湛江市,霞山区,湛江市松树港医院,湛江市松树港医院,公立/综合医院,未知
广东省,湛江市,霞山区,湛江第四人民医院,湛江第四人民医院,公立/综合医院,未知
广东省,湛江市,霞山区,湛江市霞山区骨伤科医院,湛江市霞山区骨伤科医院,公立/综合医院,一级甲等
广东省,湛江市,霞山区,湛江市霞山区妇幼保健院,湛江市霞山区妇幼保健院,公立/综合医院,一级甲等
广东省,湛江市,霞山区,湛江市第三人民医院,湛江市第三人民医院,公立/综合医院,二级甲等
广东省,湛江市,霞山区,湛江市第二中医院,湛江市第二中医院,公立/综合医院,三级乙等
广东省,湛江市,霞山区,湛江博康医院,湛江博康医院,民营/综合医院,二级甲等
广东省,湛江市,霞山区,湛江港务局港湾医院,湛江港务局港湾医院,公立/综合医院,一级甲等
广东省,湛江市,霞山区,湛江珠江口腔医院,珠江口腔医院,其他/专科医院,二级甲等
