省,市,区,全名,别名,性质,等级
海南省,海口市,海口市,海南杏林肛肠医院,杏林医院,民营/专科医院,民营医院
海南省,海口市,海口市,海南中医药研究所附属琼岛医院,琼岛男科医院,民营/综合医院,民营医院
海南省,海口市,海口市,海口市秀英区海滨社区卫生服务站,海滨社区卫生服务站,公立/综合医院,一级甲等
海南省,海口市,海口市,海南省骨科医院,海南省骨科医院,个体户/综合医院,一级甲等
海南省,海口市,海口市,海南妇产科医院,海南妇产科医院,民营/综合医院,未知
海南省,海口市,海口市,海南医疗康复中心,海南医疗康复中心,合资/专科医院,未知
海南省,海口市,海口市,海南省海口港集团公司海港医院,海南省海口港集团公司海港医院,公立/综合医院,二级甲等
海南省,海口市,海口市,海南省人民医院,海南省人民医院,公立/综合医院,三级甲等　　
海南省,海口市,海口市,海南省农垦总局医院,海南省工人医院,公立/综合医院,三级甲等　　
海南省,海口市,海口市,海南省心血管病医院,海南省心血管病医院,公立/专科医院,未知
海南省,海口市,海口市,省计划生育生殖医学中心,省计划生育生殖医学中心,合资/专科医院,未知
海南省,海口市,海口市,意美综合医疗门诊部,意美综合医疗门诊部,合资/综合医院,未知
海南省,海口市,海口市,海秀乡卫生院,海秀乡卫生院,公立/综合医院,一级乙等
海南省,海口市,海口市,秀英社区卫生服务站,秀英社区卫生服务站,个体户/综合医院,未知
海南省,海口市,海口市,海口广安医疗综合门诊部,海口广安医疗综合门诊部,个体户/综合医院,未知
海南省,海口市,海口市,海南南方中西医结合医院,海南南方中西医结合医院,个体户/综合医院,一级甲等
海南省,海口市,海口市,海口市长流中心卫生院,海口市长流中心卫生院,个体户/综合医院,一级甲等
海南省,海口市,海口市,海口市中医院,海口市中医院,公立/综合医院,二级甲等
海南省,海口市,海口市,海口市秀英区妇幼保健站,海口市秀英区妇幼保健站,公立/综合医院,二级甲等
海南省,海口市,海口市,海口市秀英区秀英社区卫生服务站,海口市秀英区秀英社区卫生服务站,民营/综合医院,一级甲等
海南省,海口市,海口市,秀英区海秀乡卫生院,秀英区海秀乡卫生院,民营/综合医院,一级甲等
海南省,海口市,海口市,海南省军区医院,海南省军区医院,公立/综合医院,一级甲等
海南省,海口市,海口市,海南187男科医院,海南187男科医院,公立/综合医院,三级甲等　　
海南省,海口市,海口市,海南187口腔医院,解放军第一八七医院,公立/综合医院,未知
海南省,海口市,海口市,海南187口腔医院,海南187口腔医院,公立/综合医院,三级甲等　　
海南省,海口市,海口市,石山镇美安卫生院,石山镇美安卫生院,其他/其他,未知
海南省,海口市,海口市,永兴卫生院,永兴卫生院,其他/其他,未知
海南省,海口市,海口市,秀英区石山卫生院,秀英区石山卫生院,其他/其他,未知
海南省,海口市,海口市,秀华社区卫生服务站,秀华社区卫生服务站,其他/其他,未知
海南省,海口市,海口市,秀英区东山卫生院,秀英区东山卫生院,其他/其他,未知
海南省,海口市,海口市,秀英区西秀卫生院,秀英区西秀卫生院,其他/其他,未知
海南省,海口市,海口市,东方洋社区卫生服务站,东方洋社区卫生服务站,其他/其他,未知
海南省,海口市,海口市,海口市秀英区计生服务指导中心,海口市秀英区计生服务指导中心,其他/其他,未知
海南省,海口市,海口市,秀英区疾病预防控制中心,秀英区疾病预防控制中心,其他/其他,未知
海南省,海口市,海口市,东山镇卫生院,东山镇卫生院,其他/其他,未知
海南省,海口市,海口市,石山镇卫生院,石山镇卫生院,其他/其他,未知
海南省,海口市,海口市,海口市秀英区新海乡卫生院,海口市秀英区新海乡卫生院,其他/其他,未知
海南省,海口市,海口市,海南省皮肤性病防治中心秀英门诊部,海南省皮肤性病防治中心秀英门诊部,其他/其他,未知
海南省,海口市,海口市,海南省肿瘤医院,海南省肿瘤医院,其他/其他,未知
海南省,海口市,海口市,海口市皮肤性病疗养所海秀门诊,海口市皮肤性病疗养所海秀门诊,其他/门诊,未知
海南省,海口市,海口市,海南省卫生厅临床检验中心,海南省卫生厅临床检验中心,其他/其他,未知
海南省,海口市,海口市,海口市秀英区西秀镇卫生院,海口市秀英区西秀镇卫生院,公立/综合医院,未知
海南省,海口市,海口市,海口市秀英区海秀卫生院,海口市秀英区海秀卫生院,其他/其他,未知
海南省,海口市,海口市,海南省血液中心,海南省血液中心,其他/其他,未知
海南省,海口市,海口市,中国人民解放军海军四二四医院,中国人民解放军海军四二四医院,公立/综合医院,一级甲等
海南省,海口市,海口市,海南琼岛男科医院,海南男科医院,民营/专科医院,民营医院
海南省,海口市,海口市,海南琼岛医院,海南中医药研究所附属琼岛医院,其他/综合医院,未评级
海南省,海口市,海口市,海南口腔医院,海南口腔医院,合资/口腔医院,未知
海南省,海口市,海口市,海南现代女子医院,海南现代女子医院,个体户/综合医院,一级甲等
海南省,海口市,海口市,海南中医药研究所附属医院,海南附属琼岛医院,公立/综合医院,一级甲等
海南省,海口市,海口市,海口仁爱医院,海口仁爱医院,其他/综合医院,未评级
海南省,海口市,海口市,海南骨科医院,北京宣武医院疼痛诊疗中心海南分中心,民营/专科医院,未知
海南省,海口市,海口市,海南现代男科医院,男科医院,民营/专科医院,未知
海南省,海口市,海口市,海南美媛医学美容门诊部,海南美媛整形医院,民营/门诊,未评级
海南省,海口市,海口市,琼山区三门坡镇卫生院,琼山区三门坡镇卫生院,其他/其他,未知
海南省,海口市,海口市,滨海社区服务中心,滨海社区服务中心,其他/其他,未知
海南省,海口市,海口市,农垦医院海垦门诊,农垦医院海垦门诊,其他/其他,未知
海南省,海口市,海口市,坡博接种门诊,坡博接种门诊,其他/其他,未知
海南省,海口市,海口市,遵谭卫生院,遵谭卫生院,其他/其他,未知
海南省,海口市,海口市,海南省龙华区城西门诊,海南省龙华区城西门诊,其他/其他,未知
海南省,海口市,海口市,农垦防疫站,农垦防疫站,其他/其他,未知
海南省,海口市,海口市,海南省新华门诊,海南省新华门诊,其他/其他,未知
海南省,海口市,海口市,龙桥卫生院,龙桥卫生院,其他/其他,未知
海南省,海口市,海口市,海南省滨涯门诊,海南省滨涯门诊,其他/其他,未知
海南省,海口市,海口市,昌茂卫生服务站,昌茂卫生服务站,其他/其他,未知
海南省,海口市,海口市,金盘卫生服务站,金盘卫生服务站,其他/其他,未知
海南省,海口市,海口市,新坡卫生院,新坡卫生院,其他/其他,未知
海南省,海口市,海口市,龙泉镇卫生院,龙泉镇卫生院,其他/其他,未知
海南省,海口市,海口市,海南省头铺门诊,海南省头铺门诊,其他/其他,未知
海南省,海口市,海口市,华南接种门诊,华南接种门诊,其他/其他,未知
海南省,海口市,海口市,苍西合作医疗站,苍西合作医疗站,其他/其他,未知
海南省,海口市,海口市,海南省医院龙华接种门诊,海南省医院龙华接种门诊,其他/其他,未知
海南省,海口市,海口市,海口市龙华区疾病预防控制中心,海口市龙华区疾病预防控制中心,其他/其他,未知
海南省,海口市,海口市,龙泉镇卫生院,龙泉镇卫生院,其他/综合医院,未知
海南省,海口市,海口市,新坡镇卫生院,新坡镇卫生院,其他/其他,未知
海南省,海口市,海口市,遵谭镇卫生院,遵谭镇卫生院,其他/其他,未知
海南省,海口市,海口市,龙泉镇卫生院美仁坡分院,龙泉镇卫生院美仁坡分院,其他/其他,未知
海南省,海口市,海口市,海南妇产科医院华西门诊部,海南妇产科医院华西门诊部,其他/门诊,未知
海南省,海口市,海口市,海南省人民医院海口门诊部,海南省人民医院海口门诊部,公立/综合医院,未知
海南省,海口市,海口市,海南省地质医院,海南省地质医院,公立/综合医院,二级甲等
海南省,海口市,海口市,海南省安宁医院,海南省安宁医院,公立/综合医院,二级甲等
海南省,海口市,海口市,海南省口腔医院,海南省口腔医院,民营/专科医院,二级甲等
海南省,海口市,海口市,海南省眼科医院,海南省眼科医院,民营/综合医院,二级甲等
海南省,海口市,海口市,海南医学院附属医院,海南医学院附属医院,公立/综合医院,三级甲等　　
海南省,海口市,海口市,中国人民解放军第一八七中心医院,海南187医院,公立/综合医院,三级甲等　　
海南省,海口市,海口市,海南骨科医院,北京宣武医院疼痛诊疗中心海南分中心,民营/专科医院,未知
海南省,海口市,海口市,海南现代妇婴医院,海南现代妇婴医院,民营/综合医院,未知
海南省,海口市,海口市,洋浦王秀兰内科诊所,洋浦王秀兰内科诊所,个体户/综合医院,未知
海南省,海口市,海口市,盛泰诊所,盛泰诊所,合资/综合医院,未知
海南省,海口市,海口市,海南医学院附属医院昌茂花园门诊部,海南医学院附属医院昌茂花园门诊部,公立/综合医院,未知
海南省,海口市,海口市,海南国际鹤春园疗养康复中心门诊部,海南国际鹤春园疗养康复中心门诊部,合资/综合医院,未知
海南省,海口市,海口市,海南口腔医院,海南口腔医院,合资/专科医院,未知
海南省,海口市,海口市,海口眼科中心,海口眼科中心,合资/综合医院,未知
海南省,海口市,海口市,海口龙华朱荣琴诊所,海口龙华朱荣琴诊所,个体户/门诊,未知
海南省,海口市,海口市,海口龙华孟祥荣诊所,海口龙华孟祥荣诊所,个体户/门诊,未知
海南省,海口市,海口市,海口龙华本富堂中西医结合诊,海口龙华本富堂中西医结合诊,个体户/综合医院,未知
海南省,海口市,海口市,海南省司法医院,海南省司法医院,公立/综合医院,未知
海南省,海口市,海口市,龙华区金盘社区卫生服务站,龙华区金盘社区卫生服务站,个体户/综合医院,一级甲等
海南省,海口市,海口市,海口市振东区妇幼保健所,海口市振东区妇幼保健所,公立/综合医院,二级甲等
海南省,海口市,海口市,海口市职业病防治所,海口市职业病防治所,公立/综合医院,二级甲等
海南省,海口市,海口市,海南省骨科医院,都军区八一骨科医院海南分院,民营/专科医院,二级甲等
海南省,海口市,海口市,海口妇产科医院,海口妇产科医院,民营/综合医院,二级甲等
海南省,海口市,海口市,海口市二轻医院,海口市二轻医院,公立/综合医院,二级甲等
海南省,海口市,海口市,海南省皮肤病医院,海南省皮肤性病防治中心,公立/专科医院,二级甲等
海南省,海口市,海口市,白坡里社区卫生服务站,白坡里社区卫生服务站,其他/其他,未知
海南省,海口市,海口市,琼山区防疫站接种门诊,琼山区防疫站接种门诊,其他/其他,未知
海南省,海口市,海口市,东昌农场医院,东昌农场医院,其他/综合医院,未知
海南省,海口市,海口市,琼山区高登社区服务站,琼山区高登社区服务站,其他/其他,未知
海南省,海口市,海口市,琼山区红明农场医院,琼山区红明农场医院,其他/其他,未知
海南省,海口市,海口市,海南省妇幼保健院接种门诊,海南省妇幼保健院接种门诊,其他/其他,未知
海南省,海口市,海口市,琼山区大园社区服务站,琼山区大园社区服务站,其他/其他,未知
海南省,海口市,海口市,琼山区米铺社区服务站,琼山区米铺社区服务站,其他/其他,未知
海南省,海口市,海口市,琼山区道客社区服务站,琼山区道客社区服务站,其他/其他,未知
海南省,海口市,海口市,琼山区旧州镇卫生院,琼山区旧州镇卫生院,其他/其他,未知
海南省,海口市,海口市,琼山区甲子镇卫生院,琼山区甲子镇卫生院,其他/其他,未知
海南省,海口市,海口市,琼山区大坡镇卫生院,琼山区大坡镇卫生院,其他/其他,未知
海南省,海口市,海口市,琼山区谭文卫生院,琼山区谭文卫生院,其他/其他,未知
海南省,海口市,海口市,琼山红旗镇中心卫生院,琼山红旗镇中心卫生院,其他/其他,未知
海南省,海口市,海口市,琼山区云龙镇卫生院,琼山区云龙镇卫生院,其他/其他,未知
海南省,海口市,海口市,琼山区龙塘卫生院,琼山区龙塘卫生院,其他/其他,未知
海南省,海口市,海口市,琼山府城镇铁桥卫生院,琼山府城镇铁桥卫生院,其他/其他,未知
海南省,海口市,海口市,海口琼山区府城卫生院,海口琼山区府城卫生院,其他/其他,未知
海南省,海口市,海口市,琼山三门坡镇卫生院第二门诊部,琼山三门坡镇卫生院第二门诊部,公立/门诊,未知
海南省,海口市,海口市,铁桥卫生院第二门诊,铁桥卫生院第二门诊,其他/门诊,未知
海南省,海口市,海口市,铁桥卫生院第一门诊,铁桥卫生院第一门诊,其他/门诊,未知
海南省,海口市,海口市,红明农场医院第二门诊部,红明农场医院第二门诊部,其他/门诊,未知
海南省,海口市,海口市,琼山红十字会门诊部,琼山红十字会门诊部,其他/未知,未知
海南省,海口市,海口市,琼山中医院三峰门诊部,琼山中医院三峰门诊部,其他/门诊,未知
海南省,海口市,海口市,琼山中医院中西医结合门诊部,琼山中医院中西医结合门诊部,其他/门诊,未知
海南省,海口市,海口市,琼山中医院综合门诊,琼山中医院综合门诊,其他/门诊,未知
海南省,海口市,海口市,琼山中医院第二门诊部,琼山中医院第二门诊部,其他/门诊,未知
海南省,海口市,海口市,琼山中医院第一门诊,琼山中医院第一门诊,其他/门诊,未知
海南省,海口市,海口市,琼山人民医院皮肤病门诊,琼山人民医院皮肤病门诊,其他/门诊,未知
海南省,海口市,海口市,琼山中医院第五门诊部,琼山中医院第五门诊部,其他/门诊,未知
海南省,海口市,海口市,琼山人民医院第三门诊,琼山人民医院第三门诊,其他/门诊,未知
海南省,海口市,海口市,琼山人民医院第二门诊,琼山人民医院第二门诊,其他/门诊,未知
海南省,海口市,海口市,琼山计划生育服务站,琼山计划生育服务站,其他/其他,未知
海南省,海口市,海口市,琼山结核病防治所,琼山结核病防治所,其他/其他,未知
海南省,海口市,海口市,琼山卫生防疫站,琼山卫生防疫站,其他/其他,未知
海南省,海口市,海口市,琼山残疾儿童康复中心,琼山残疾儿童康复中心,其他/其他,未知
海南省,海口市,海口市,三门坡卫生院谭文分院,三门坡卫生院谭文分院,其他/其他,未知
海南省,海口市,海口市,海南福兴康复医院,海南福兴男科医院,其他/专科医院,未知
海南省,海口市,海口市,海口市琼山区大园社区卫生服务站,海口市琼山区大园社区卫生服务站,民营/综合医院,一级甲等
海南省,海口市,海口市,琼山市中医院,琼山市中医院,公立/中医医院,未知
海南省,海口市,海口市,海口市琼山区残疾儿童康复中心,海口市琼山区残疾儿童康复中心,公立/儿童医院,未知
海南省,海口市,海口市,国营红明农场医院,国营红明农场医院,公立/综合医院,一级甲等
海南省,海口市,海口市,海口市琼山区华厦康复中心,海口市琼山区华厦康复中心,公立/综合医院,未知
海南省,海口市,海口市,海口市琼山区人民医院,海口市琼山区人民医院,公立/综合医院,未知
海南省,海口市,海口市,海口市府城医院,海口市第四人民医院,公立/综合医院,一级甲等
海南省,海口市,海口市,海口市琼山区桂林洋农场医院,海口市琼山区桂林洋农场医院,公立/综合医院,一级甲等
海南省,海口市,海口市,海南省琼山区府城医院,海南省琼山区府城医院,公立/综合医院,一级甲等
海南省,海口市,海口市,海口市琼山区中医院,海口市琼山区中医院,公立/综合医院,一级甲等
海南省,海口市,海口市,海口市琼山人民医院,海口市琼山人民医院,公立/综合医院,二级甲等
海南省,海口市,海口市,海南省妇幼保健院,海南省妇幼保健院,公立/综合医院,二级甲等
海南省,海口市,海口市,海口市口腔病防治所,海口市口腔病防治所,公立/专科医院,未知
海南省,海口市,海口市,海南省老年病医院,海南省干部疗养院,公立/综合医院,未知
海南省,海口市,海口市,大园社区卫生服务站,大园社区卫生服务站,个体户/综合医院,未知
海南省,海口市,海口市,海口琼山佳诚牙科诊所,海口琼山佳诚牙科诊所,个体户/综合医院,未知
海南省,海口市,海口市,海口肤康医院,海口肤康皮肤病医院,其他/专科医院,二级甲等
海南省,海口市,海口市,桂林洋农场防疫组,桂林洋农场防疫组,其他/其他,未知
海南省,海口市,海口市,演丰中心卫生院,演丰中心卫生院,其他/其他,未知
海南省,海口市,海口市,琼苑社区卫生服务站,琼苑社区卫生服务站,其他/其他,未知
海南省,海口市,海口市,锦山里社区卫生服务站,锦山里社区卫生服务站,其他/其他,未知
海南省,海口市,海口市,海达社区卫生服务站,海达社区卫生服务站,其他/其他,未知
海南省,海口市,海口市,振兴社区卫生服务站,振兴社区卫生服务站,其他/其他,未知
海南省,海口市,海口市,五贤社区卫生服务站,五贤社区卫生服务站,其他/其他,未知
海南省,海口市,海口市,公园后社区卫生服务站,公园后社区卫生服务站,其他/其他,未知
海南省,海口市,海口市,青年路卫生服务站,青年路卫生服务站,其他/其他,未知
海南省,海口市,海口市,和平南社区卫生服务站,和平南社区卫生服务站,其他/其他,未知
海南省,海口市,海口市,龙舌坡社区卫生服务站,龙舌坡社区卫生服务站,其他/其他,未知
海南省,海口市,海口市,演丰镇演海卫生院,演丰镇演海卫生院,其他/其他,未知
海南省,海口市,海口市,白龙南社区卫生服务站,白龙南社区卫生服务站,其他/其他,未知
海南省,海口市,海口市,振东卫生院,振东卫生院,其他/其他,未知
海南省,海口市,海口市,海甸社区卫生服务站,海甸社区卫生服务站,其他/其他,未知
海南省,海口市,海口市,银甸社区卫生服务站,银甸社区卫生服务站,其他/其他,未知
海南省,海口市,海口市,东湖里社区卫生服务站,东湖里社区卫生服务站,其他/其他,未知
海南省,海口市,海口市,海南省疾病预防保健中心,海南省疾病预防保健中心,其他/其他,未知
海南省,海口市,海口市,海口市疾控中心接种门诊,海口市疾控中心接种门诊,其他/其他,未知
海南省,海口市,海口市,灵山镇东营卫生院,灵山镇东营卫生院,其他/其他,未知
海南省,海口市,海口市,新利社区卫生服务站,新利社区卫生服务站,其他/其他,未知
海南省,海口市,海口市,大致坡镇咸来卫生院,大致坡镇咸来卫生院,其他/其他,未知
海南省,海口市,海口市,海口市美兰区计划生育服务站,海口市美兰区计划生育服务站,其他/其他,未知
海南省,海口市,海口市,海南省罗牛山监狱卫生院,海南省罗牛山监狱卫生院,其他/其他,未知
海南省,海口市,海口市,海口市振东助残康复门诊,海口市振东助残康复门诊,其他/其他,未知
海南省,海口市,海口市,海南省农垦桂林洋医院,海南省农垦桂林洋医院,其他/综合医院,未知
海南省,海口市,海口市,灵山镇卫生院,灵山镇卫生院,其他/综合医院,未知
海南省,海口市,海口市,美兰镇中心卫生院演海分院,美兰镇中心卫生院演海分院,其他/综合医院,未知
海南省,海口市,海口市,海口市人民医院海口市红十字医院,海口市人民医院海口市红十字医院,公立/综合医院,一级甲等
海南省,海口市,海口市,海口市振东区博爱医疗中心,海口市振东区博爱医疗中心,民营/综合医院,一级甲等
海南省,海口市,海口市,武警海南省总队医院,海南男科医院,公立/综合医院,二级甲等
海南省,海口市,海口市,海南省中医院,海南省中医院,公立/综合医院,三级甲等　　
海南省,海口市,海口市,海口市人民医院,中南大学湘雅医学院附属海口医院,公立/综合医院,三级甲等　　
海南省,海口市,海口市,海南省农垦总局医院东湖院区,海南省农垦总局医院东湖院区,公立/综合医院,三级甲等　　
海南省,海口市,海口市,海南省人民医院海府路门诊部,海南省人民医院海府路门诊部,公立/门诊,未评级
海南省,海口市,海口市,海南同济门诊部,海南同济门诊部,个体户/综合医院,未知
海南省,海口市,海口市,海南省医院管理协会门诊部,海南省医院管理协会门诊部,公立/综合医院,未知
海南省,海口市,海口市,海口市振东区卫生院,海口市振东区卫生院,个体户/综合医院,未知
海南省,海口市,海口市,海联卫生院,海联卫生院,合资/综合医院,未知
海南省,海口市,海口市,美兰区博爱医疗中心,美兰区博爱医疗中心,个体户/综合医院,未知
海南省,海口市,海口市,白龙卫生院,白龙卫生院,合资/综合医院,未知
海南省,海口市,海口市,海口美兰余春霞诊所,海口美兰余春霞诊所,个体户/综合医院,未知
海南省,海口市,海口市,海口美兰仁德爱门诊部,海口美兰仁德爱门诊部,个体户/综合医院,未知
海南省,海口市,海口市,海口美兰黄高林诊所,海口美兰黄高林诊所,个体户/综合医院,未知
海南省,海口市,海口市,海口美兰博爱综合门诊部,海口美兰博爱综合门诊部,个体户/综合医院,未知
海南省,海口市,海口市,海南省工人疗养院,海南省工人疗养院,公立/综合医院,未知
海南省,海口市,海口市,海南南方肛肠病医院,海南南方肛肠病医院,公立/专科医院,二级甲等
海南省,海口市,海口市,海南现代妇女儿童医院,海南现代妇女儿童医院,民营/专科医院,未知
海南省,海口市,海口市,海口市结核病防治所,海口市结核病防治所,公立/综合医院,二级甲等
海南省,海口市,海口市,海南港岛联合中医肿瘤医院,海南港岛联合中医肿瘤医院,民营/专科医院,二级甲等
海南省,海口市,海口市,海南中西医结合医院,海南中西医结合医院,民营/综合医院,二级甲等
海南省,海口市,海口市,海口市妇幼保健院,海口市妇女儿童医院,公立/专科医院,二级甲等
海南省,海口市,海口市,海南武警总队医院,海南武警男科医院,公立/综合医院,二级甲等
海南省,海口市,海口市,海口市皮肤性病防治中心,海口市皮肤性病防治中心,公立/综合医院,一级甲等
海南省,海口市,海口市,海南新建康美兆体检医院,美兆体检,其他/其他,民营医院
海南省,海口市,海口市,海南省皮肤性病防治中心,海南省皮肤性病防治中心,公立/其他,未知
海南省,海口市,海口市,海南省农垦东昌医院,海南省农垦东昌医院,其他/综合医院,未知
海南省,海口市,海口市,海南省人民医院中西医门诊部,海南省人民医院中西医门诊部,其他/门诊,未知
海南省,海口市,海口市,海南省人民医院康复中心,海南省人民医院康复中心,其他/其他,未知
海南省,海口市,海口市,海口市卫生防疫站专科门诊,海口市卫生防疫站专科门诊,其他/门诊,未知
海南省,海口市,海口市,海口市皮肤性病疗养所,海口市皮肤性病疗养所,其他/其他,未知
海南省,海口市,海口市,海口市秀英区防疫站,海口市秀英区防疫站,其他/其他,未知
