省,市,区,全名,别名,性质,等级
安徽省,合肥市,长丰县,长丰县双墩镇新集村卫生室,长丰县双墩镇新集村卫生室,其他/综合医院,未知
安徽省,合肥市,长丰县,长丰县义井红桥村卫生室,长丰县义井红桥村卫生室,其他/综合医院,未知
安徽省,合肥市,长丰县,长丰县甄庙医院,长丰县甄庙医院,民营/综合医院,未知
安徽省,合肥市,长丰县,长丰县水湖镇大周村卫生室,长丰县水湖镇大周村卫生室,其他/综合医院,未知
安徽省,合肥市,长丰县,长丰县庄墓镇杨湾村卫生室,长丰县庄墓镇杨湾村卫生室,公立/专科医院,未知
安徽省,合肥市,长丰县,长丰县庄墓镇徐岗村卫生室,长丰县庄墓镇徐岗村卫生室,公立/专科医院,未知
安徽省,合肥市,长丰县,长丰县庄墓镇街道社区卫生服务站,长丰县庄墓镇街道社区卫生服务站,公立/专科医院,未知
安徽省,合肥市,长丰县,长丰县左店乡淮光村卫生室,长丰县左店乡淮光村卫生室,公立/专科医院,未知
安徽省,合肥市,长丰县,长丰县左店陆桥村卫生室,长丰县左店陆桥村卫生室,其他/综合医院,未知
安徽省,合肥市,长丰县,长丰县左店乡永丰村卫生室,长丰县左店乡永丰村卫生室,其他/专科医院,未知
安徽省,合肥市,长丰县,长丰县朱巷镇七里村卫生室,长丰县朱巷镇七里村卫生室,其他/综合医院,未知
安徽省,合肥市,长丰县,长丰县朱巷镇梁圩村卫生室,长丰县朱巷镇梁圩村卫生室,其他/综合医院,未知
安徽省,合肥市,长丰县,长丰县造甲乡凤群村卫生室,长丰县造甲乡凤群村卫生室,其他/综合医院,未知
安徽省,合肥市,长丰县,长丰县造甲乡宋岗村卫生室,长丰县造甲乡宋岗村卫生室,其他/综合医院,未知
安徽省,合肥市,长丰县,长丰县造甲乡马塘村卫生室,长丰县造甲乡马塘村卫生室,其他/综合医院,未知
安徽省,合肥市,长丰县,长丰县造甲乡凤楼村卫生室,长丰县造甲乡凤楼村卫生室,其他/综合医院,未知
安徽省,合肥市,长丰县,长丰县造甲乡六方村卫生室,长丰县造甲乡六方村卫生室,其他/综合医院,未知
安徽省,合肥市,长丰县,长丰县造甲乡双河村卫生室,长丰县造甲乡双河村卫生室,其他/综合医院,未知
安徽省,合肥市,长丰县,长丰县造甲乡许圩村卫生室,长丰县造甲乡许圩村卫生室,其他/综合医院,未知
安徽省,合肥市,长丰县,长丰县杨庙云峰村卫生室,长丰县杨庙云峰村卫生室,其他/综合医院,未知
安徽省,合肥市,长丰县,长丰县杨庙十井村卫生室,长丰县杨庙十井村卫生室,其他/综合医院,未知
安徽省,合肥市,长丰县,长丰县下塘北店村卫生室,长丰县下塘北店村卫生室,其他/综合医院,未知
安徽省,合肥市,长丰县,长丰县下塘镇王户村卫生室,长丰县下塘镇王户村卫生室,其他/综合医院,未知
安徽省,合肥市,长丰县,长丰县下塘幸福村卫生室,长丰县下塘幸福村卫生室,其他/综合医院,未知
安徽省,合肥市,长丰县,长丰县下塘新集村卫生室,长丰县下塘新集村卫生室,其他/综合医院,未知
安徽省,合肥市,长丰县,长丰县下塘镇南郢村卫生室,长丰县下塘镇南郢村卫生室,公立/专科医院,未知
安徽省,合肥市,长丰县,长丰县下塘镇李桥村卫生室,长丰县下塘镇李桥村卫生室,公立/综合医院,未知
安徽省,合肥市,长丰县,长丰县吴山镇桥冲村卫生室,长丰县吴山镇桥冲村卫生室,公立/专科医院,未知
安徽省,合肥市,长丰县,长丰县吴山高岗村卫生室,长丰县吴山高岗村卫生室,其他/综合医院,未知
安徽省,合肥市,长丰县,长丰县吴山车左村卫生室,长丰县吴山车左村卫生室,其他/综合医院,未知
安徽省,合肥市,长丰县,长丰县吴山镇官府村卫生室,长丰县吴山镇官府村卫生室,其他/综合医院,未知
安徽省,合肥市,长丰县,长丰县吴山岗楼村卫生室,长丰县吴山岗楼村卫生室,其他/综合医院,未知
安徽省,合肥市,长丰县,长丰县吴山四墩村卫生室,长丰县吴山四墩村卫生室,其他/综合医院,未知
安徽省,合肥市,长丰县,长丰县吴山楼西村卫生室,长丰县吴山楼西村卫生室,其他/综合医院,未知
安徽省,合肥市,长丰县,长丰县吴山胜岗村卫生室,长丰县吴山胜岗村卫生室,其他/综合医院,未知
安徽省,合肥市,长丰县,长丰县吴山镇牌碑村卫生室,长丰县吴山镇牌碑村卫生室,其他/综合医院,未知
安徽省,合肥市,长丰县,长丰县陶楼乡陶西村卫生室,长丰县陶楼乡陶西村卫生室,其他/综合医院,未知
安徽省,合肥市,长丰县,长丰县陶楼乡陈祠村卫生室,长丰县陶楼乡陈祠村卫生室,其他/综合医院,未知
安徽省,合肥市,长丰县,长丰县陶楼乡高塘村卫生室,长丰县陶楼乡高塘村卫生室,其他/综合医院,未知
安徽省,合肥市,长丰县,长丰县双凤工业区医院,长丰县双凤工业区医院,民营/综合医院,未知
安徽省,合肥市,长丰县,长丰县罗塘樊祠村卫生室,长丰县罗塘樊祠村卫生室,其他/综合医院,未知
安徽省,合肥市,长丰县,长丰县罗塘叶集村卫生室,长丰县罗塘叶集村卫生室,其他/综合医院,未知
安徽省,合肥市,长丰县,长丰县罗塘乡上拐村卫生室,长丰县罗塘乡上拐村卫生室,其他/综合医院,未知
安徽省,合肥市,长丰县,长丰县罗塘庄岗村卫生室,长丰县罗塘庄岗村卫生室,其他/综合医院,未知
安徽省,合肥市,长丰县,长丰县罗塘双合村卫生室,长丰县罗塘双合村卫生室,其他/综合医院,未知
安徽省,合肥市,长丰县,长丰县罗塘乡岳岗村卫生室,长丰县罗塘乡岳岗村卫生室,其他/综合医院,未知
安徽省,合肥市,长丰县,长丰县罗塘乡黄岗村卫生室,长丰县罗塘乡黄岗村卫生室,其他/综合医院,未知
安徽省,合肥市,长丰县,长丰县徐庙卫生院,长丰县徐庙卫生院,公立/综合医院,未知
安徽省,合肥市,长丰县,长丰县岗集镇张庙村卫生室,长丰县岗集镇张庙村卫生室,其他/综合医院,未知
安徽省,合肥市,长丰县,长丰县岗集松棵村卫生室,长丰县岗集松棵村卫生室,其他/综合医院,未知
安徽省,合肥市,长丰县,长丰县岗集新元村卫生室,长丰县岗集新元村卫生室,其他/综合医院,未知
安徽省,合肥市,长丰县,长丰县岗集镇牛寨村卫生室,长丰县岗集镇牛寨村卫生室,其他/综合医院,未知
安徽省,合肥市,长丰县,长丰县岗集大窑村卫生室,长丰县岗集大窑村卫生室,其他/综合医院,未知
安徽省,合肥市,长丰县,长丰县岗集双庙村卫生室,长丰县岗集双庙村卫生室,其他/综合医院,未知
安徽省,合肥市,长丰县,长丰县岗集中心卫生院,长丰县岗集中心卫生院,公立/综合医院,未知
安徽省,合肥市,长丰县,长丰县杜集乡陈岗村卫生室,长丰县杜集乡陈岗村卫生室,其他/综合医院,未知
安徽省,合肥市,长丰县,长丰县杜集乡振兴村卫生室,长丰县杜集乡振兴村卫生室,其他/综合医院,未知
安徽省,合肥市,长丰县,长丰县杜集乡创新村卫生室,长丰县杜集乡创新村卫生室,其他/综合医院,未知
安徽省,合肥市,长丰县,长丰县杜集高祠村卫生室,长丰县杜集高祠村卫生室,其他/综合医院,未知
安徽省,合肥市,长丰县,长丰县杜集刘兴村卫生室,长丰县杜集刘兴村卫生室,其他/综合医院,未知
安徽省,合肥市,长丰县,长丰县杜集邱集村卫生室,长丰县杜集邱集村卫生室,其他/综合医院,未知
安徽省,合肥市,长丰县,长丰县杜集乡杜集村卫生室,长丰县杜集乡杜集村卫生室,其他/专科医院,未知
安徽省,合肥市,长丰县,长丰县杜集乡卫生院,长丰县杜集乡卫生院,公立/综合医院,未知
安徽省,合肥市,长丰县,长丰县杜集乡沛河卫生院,长丰县杜集乡沛河卫生院,公立/综合医院,未知
安徽省,合肥市,长丰县,长丰县左店乡梁埝村卫生室,长丰县左店乡梁埝村卫生室,其他/其他,未知
安徽省,合肥市,长丰县,长丰县罗塘乡张岗村卫生室,长丰县罗塘乡张岗村卫生室,其他/其他,未知
安徽省,合肥市,长丰县,长丰县农场医院,长丰县农场医院,公立/综合医院,未知
安徽省,合肥市,长丰县,长丰县妇幼保健所,长丰县妇幼保健所,公立/综合医院,未知
安徽省,合肥市,长丰县,长丰县中医院,长丰县中医院,公立/综合医院,未知
安徽省,合肥市,长丰县,长丰县第二人民医院,长丰县第二人民医院,公立/综合医院,未知
安徽省,合肥市,长丰县,长丰县人民医院,长丰县人民医院,公立/综合医院,未知
安徽省,合肥市,长丰县,长丰县水湖镇李杨村卫生室,长丰县水湖镇李杨村卫生室,其他/其他,未知
安徽省,合肥市,长丰县,长丰县水湖镇周巷村卫生室,长丰县水湖镇周巷村卫生室,其他/其他,未知
安徽省,合肥市,长丰县,长丰县水湖镇孔圩村卫生室,长丰县水湖镇孔圩村卫生室,其他/其他,未知
安徽省,合肥市,长丰县,长丰县双墩镇华丰村卫生室,长丰县双墩镇华丰村卫生室,其他/其他,未知
安徽省,合肥市,长丰县,长丰县双墩镇白大塘社区卫生服务站,长丰县双墩镇白大塘社区卫生服务站,其他/其他,未知
