省,市,区,全名,别名,性质,等级
黑龙江省,哈尔滨市,南岗区,哈尔滨盛京白癜风医学研究院,哈尔滨白癜风医院,其他/专科医院,未评级
黑龙江省,哈尔滨市,南岗区,哈尔滨银屑病医院,哈尔滨冰城银屑病医院_黑龙江哈尔滨银屑病医院,其他/专科医院,未知
黑龙江省,哈尔滨市,南岗区,黑龙江省青年医学会附属医院,黑龙江省青年医学会附属医院,公立/综合医院,三级甲等　　
黑龙江省,哈尔滨市,南岗区,铁道部第三工程局哈尔滨医院,铁道部第三工程局哈尔滨医院,公立/综合医院,一级甲等
黑龙江省,哈尔滨市,南岗区,黑龙江省中龙医药专科研究院（民营）,黑龙江省中龙医药专科研究院,个体户/综合医院,一级甲等
黑龙江省,哈尔滨市,南岗区,哈尔滨壮一堂中医医院,哈尔滨壮一堂中医性病医院（性病科）,公立/综合医院,特级医院
黑龙江省,哈尔滨市,南岗区,哈尔滨臻美医疗美容门诊部,哈尔滨臻美整形医院,民营/专科医院,民营医院
黑龙江省,哈尔滨市,南岗区,黑龙江省总工会医院,总工会医院,公立/综合医院,一级甲等
黑龙江省,哈尔滨市,南岗区,黑龙江省总工会医院,黑龙江省总工会医院,公立/综合医院,一级甲等
黑龙江省,哈尔滨市,南岗区,黑龙江和平医院,黑龙江和平医院,公立/综合医院,一级甲等
黑龙江省,哈尔滨市,南岗区,黑龙江瑞丽整形美容医院,哈尔滨瑞丽整形美容医院_哈尔滨整形医院,民营/其他,民营医院
黑龙江省,哈尔滨市,南岗区,哈尔滨市南岗区王岗中心医院,哈尔滨市南岗区王岗医院,公立/综合医院,一级甲等
黑龙江省,哈尔滨市,南岗区,哈尔滨皮肤病医院,黑龙江皮肤病医院,合资/专科医院,未知
黑龙江省,哈尔滨市,南岗区,黑龙江省消防总队医院,哈尔滨省消防总队医院,公立/综合医院,未评级
黑龙江省,哈尔滨市,南岗区,黑龙江瑞京糖尿病医院,黑龙江瑞京糖尿病医院,民营/专科医院,未评级
黑龙江省,哈尔滨市,南岗区,黑龙江和美妇产医院,哈尔滨和美妇产医院,民营/专科医院,民营医院
黑龙江省,哈尔滨市,南岗区,哈尔滨哈美莱医疗美容医院,哈美莱医疗美容医院,民营/专科医院,民营医院
黑龙江省,哈尔滨市,南岗区,黑龙江现代肛肠医院,哈尔滨现代肛肠医院,民营/专科医院,民营医院
黑龙江省,哈尔滨市,南岗区,哈尔滨友谊神康医院,哈尔滨友谊男科医院,民营/专科医院,民营医院
黑龙江省,哈尔滨市,南岗区,哈尔滨君康皮肤病医院,黑龙江君康皮肤病医院,民营/专科医院,未知
黑龙江省,哈尔滨市,南岗区,中国人民解放军哈尔滨宏征医院,中国人民解放军哈尔滨宏征医院,公立/综合医院,一级甲等
黑龙江省,哈尔滨市,南岗区,武警黄金第一总队医院,武警黄金医院，中国人民武装警察部队黄金第一总队医院,公立/综合医院,二级甲等
黑龙江省,哈尔滨市,南岗区,黑龙江红十字医疗康复中心,黑龙江红十字医疗康复中心,公立/综合医院,一级甲等
黑龙江省,哈尔滨市,南岗区,哈尔滨市南岗区人民医院,哈尔滨市南岗区人民医院,公立/综合医院,二级甲等
黑龙江省,哈尔滨市,南岗区,空军八六00一部队医院,空军八六00一部队医院,公立/综合医院,二级甲等
黑龙江省,哈尔滨市,南岗区,黑龙江南岗区中医院,黑龙江南岗区中医院,公立/中医医院,未知
黑龙江省,哈尔滨市,南岗区,哈尔滨医科大学口腔医院, 哈尔滨医科大学口腔医院,公立/口腔医院,未知
黑龙江省,哈尔滨市,南岗区,黑龙江长庚耳鼻喉医院,黑龙江长庚耳鼻喉医院,民营/专科医院,未知
黑龙江省,哈尔滨市,南岗区,黑龙江玛丽亚妇产医院,黑龙江玛丽亚妇产医院,民营/专科医院,未知
黑龙江省,哈尔滨市,南岗区,黑龙江省中航医院,黑龙江中航医院,合资/综合医院,未知
黑龙江省,哈尔滨市,南岗区,黑龙江中德骨科医院,哈尔滨中德骨科医院,民营/专科医院,未知
黑龙江省,哈尔滨市,南岗区,哈尔滨性病研究所,哈尔滨性病研究所,民营/专科医院,未评级
黑龙江省,哈尔滨市,南岗区,黑龙江盛京皮肤病医院,黑龙江盛京皮肤病医院,民营/专科医院,民营医院
黑龙江省,哈尔滨市,南岗区,哈尔滨中医皮肤病医院,哈尔滨长安医院,民营/综合医院,未知
黑龙江省,哈尔滨市,南岗区,哈尔滨欧亚男科医院,哈尔滨男科医院,其他/专科医院,未知
黑龙江省,哈尔滨市,南岗区,献臣皮肤病专科医院,献臣皮肤中医院,民营/专科医院,民营医院
黑龙江省,哈尔滨市,南岗区,哈尔滨皮肤病研究所,哈尔滨皮肤病研究所,民营/专科医院,三级乙等
黑龙江省,哈尔滨市,南岗区,哈尔滨圣安口腔专科医院,哈尔滨圣安口腔医院,民营/专科医院,民营医院
黑龙江省,哈尔滨市,南岗区,黑龙江省和平医院,哈尔滨和平医院,合资/综合医院,二级甲等
黑龙江省,哈尔滨市,南岗区,哈尔滨市穆斯林医院,哈尔滨市穆斯林医院,公立/综合医院,二级甲等
黑龙江省,哈尔滨市,南岗区,哈尔滨市南岗区大成医院,哈尔滨市南岗区大成医院,公立/综合医院,二级甲等
黑龙江省,哈尔滨市,南岗区,哈尔滨市人防医院,哈尔滨市人防医院,公立/综合医院,二级甲等
黑龙江省,哈尔滨市,南岗区,哈尔滨市南岗区妇幼保健所,哈尔滨市南岗区妇幼保健所,公立/综合医院,二级甲等
黑龙江省,哈尔滨市,南岗区,哈尔滨市南岗区妇产医院,哈尔滨市南岗区妇产医院,公立/综合医院,二级甲等
黑龙江省,哈尔滨市,南岗区,哈尔滨市养老院康复医院,哈尔滨市养老院康复医院,公立/综合医院,二级甲等
黑龙江省,哈尔滨市,南岗区,哈尔滨市师大脑血栓医院,哈尔滨市师大脑血栓医院,公立/综合医院,二级甲等
黑龙江省,哈尔滨市,南岗区,哈尔滨工程大学医院,哈尔滨工程大学医院,公立/综合医院,二级甲等
黑龙江省,哈尔滨市,南岗区,黑龙江省农垦总局总医院,黑龙江省农垦总局总医院,公立/综合医院,三级甲等　　
黑龙江省,哈尔滨市,南岗区,黑龙江中医药大学针灸推拿学院,黑龙江中医药大学附属第二医院,公立/综合医院,三级甲等　　
黑龙江省,哈尔滨市,南岗区,黑龙江省康复医院,黑龙江省第五医院,公立/专科医院,三级甲等　　
黑龙江省,哈尔滨市,南岗区,哈尔滨医科大学附属肿瘤医院,黑龙江省肿瘤医院,公立/专科医院,三级甲等　　
黑龙江省,哈尔滨市,南岗区,哈尔滨医科大学附属第四医院,哈尔滨医科大学附属第四医院,公立/综合医院,三级甲等　　
黑龙江省,哈尔滨市,南岗区,哈尔滨铁路局中心医院,哈尔滨铁路局中心医院,公立/综合医院,未知
黑龙江省,哈尔滨市,南岗区,哈尔滨市骨伤医院,哈尔滨市骨伤科医院,公立/专科医院,三级甲等　　
黑龙江省,哈尔滨市,南岗区,哈尔滨骨伤科医院,哈尔滨骨伤科医院,公立/专科医院,三级甲等　　
黑龙江省,哈尔滨市,南岗区,哈尔滨医科大学附属第二医院,哈尔滨医科大学附属第二医院,公立/综合医院,三级甲等　　
黑龙江省,哈尔滨市,南岗区,哈尔滨医科大学附属第一医院,哈尔滨医科大学附属第一医院,公立/综合医院,三级甲等　　
黑龙江省,哈尔滨市,南岗区,中国人民解放军第二一一医院,211儿童医院,公立/综合医院,三级甲等　　
黑龙江省,哈尔滨市,南岗区,哈尔滨市南岗区新春医院,哈尔滨市南岗区新春医院,公立/综合医院,二级甲等
黑龙江省,哈尔滨市,南岗区,哈尔滨市南岗区跃进医院,哈尔滨市南岗区跃进医院,公立/综合医院,二级甲等
黑龙江省,哈尔滨市,南岗区,哈尔滨市南岗区和平人民医院,哈尔滨市南岗区和平人民医院,公立/综合医院,二级甲等
黑龙江省,哈尔滨市,南岗区,哈尔滨市南岗区红十字康复医院,哈尔滨市南岗区红十字康复医院,公立/综合医院,二级甲等
黑龙江省,哈尔滨市,南岗区,哈尔滨南岗区口腔病防治院,哈尔滨南岗区口腔病防治院,公立/专科医院,二级甲等
黑龙江省,哈尔滨市,南岗区,哈尔滨市南岗区中西医结合医院,哈尔滨市南岗区中西医结合医院,公立/综合医院,二级甲等
黑龙江省,哈尔滨市,南岗区,哈尔滨市北方中医药研究院,哈尔滨市北方中医药研究院,民营/综合医院,二级甲等
黑龙江省,哈尔滨市,南岗区,哈尔滨献臣白癜风疑难病研究所,哈尔滨献臣白癜风疑难病研究所,民营/综合医院,二级甲等
黑龙江省,哈尔滨市,南岗区,哈尔滨长安医院,哈尔滨长安医院,公立/综合医院,二级甲等
黑龙江省,哈尔滨市,南岗区,哈尔滨电力医院,哈尔滨电力医院,公立/综合医院,二级甲等
黑龙江省,哈尔滨市,南岗区,哈尔滨穆斯林医院,哈尔滨穆斯林医院,公立/综合医院,二级甲等
黑龙江省,哈尔滨市,南岗区,哈尔滨船舶工程学院医院,哈尔滨船舶工程学院医院,公立/综合医院,二级甲等
黑龙江省,哈尔滨市,南岗区,哈尔滨市南岗区中医院,哈尔滨市南岗区中医院,公立/综合医院,二级甲等
黑龙江省,哈尔滨市,南岗区,哈尔滨市第九医院,哈尔滨市第九医院,公立/综合医院,二级甲等
黑龙江省,哈尔滨市,南岗区,哈尔滨铁路局结核病医院,哈尔滨铁路局结核病医院,公立/综合医院,二级甲等
黑龙江省,哈尔滨市,南岗区,黑龙江省中西医结合学会医院,黑龙江外阴白斑医院,其他/专科医院,未知
黑龙江省,哈尔滨市,南岗区,哈尔滨济华医院,哈尔滨男科医院,民营/综合医院,未知
黑龙江省,哈尔滨市,南岗区,哈尔滨武警黄金医院,黑龙江武警医院,公立/综合医院,三级甲等　　
黑龙江省,哈尔滨市,南岗区,哈尔滨铁路局肿瘤医院,哈尔滨铁路局肿瘤医院,公立/综合医院,一级甲等
黑龙江省,哈尔滨市,南岗区,黑龙江省口腔病防治院,黑龙江省口腔病防治院,其他/专科医院,未知
黑龙江省,哈尔滨市,南岗区,黑龙江省邮电医院,黑龙江省邮电医院,公立/综合医院,一级甲等
黑龙江省,哈尔滨市,南岗区,哈尔滨市职业病防治院,哈尔滨市职业病防治院,公立/综合医院,一级甲等
黑龙江省,哈尔滨市,南岗区,黑龙江省皮肤病防治研究所,黑龙江省皮肤病防治研究所,公立/综合医院,一级甲等
